{
  "schemaVersion": "1.0.0",
  "version": "v1",
  "currency": "GBP",
  "generatedAt": "2026-09-03T00:00:00Z",
  "notes": "Air India Holidays demo catalog covering two verticals on the shared Guzo/EasyGDS schema: ICC Men's Cricket World Cup 2027 (South Africa, hosted with Zimbabwe and Namibia) and Taj Holidays (real IHCL/Taj Hotels properties across India and the Maldives). basePrice.currency is GBP to satisfy scripts/lib/catalog-integrity.mjs's hardcoded currency gate and the GBP-only runtime pricing pipeline (guzo/display-currency.js, infrastructure lib/flights.js); the commercially-quoted USD prices requested for this build are preserved verbatim in each product's priceProvenance.sourceAmount/sourceCurrency and in flights.json's baseFareUsd field.",
  "products": [
    {
      "id": "pkg-cwc-opener-ind-aus-jnb",
      "type": "package",
      "name": "CWC 2027 Opener: India v Australia, Johannesburg",
      "summary": "Six days in Johannesburg for the ICC Men's Cricket World Cup 2027 tournament opener, India v Australia at The Wanderers, with Soweto heritage and the Cradle of Humankind woven around match day.",
      "destinations": [
        "johannesburg"
      ],
      "themes": [
        "cricket",
        "cwc2027",
        "first-timers",
        "city"
      ],
      "duration": {
        "days": 6,
        "nights": 5
      },
      "tier": "signature",
      "basePrice": {
        "amount": 1896,
        "currency": "GBP",
        "basis": "per-person"
      },
      "inclusions": [
        "Nonstop Air India flights Delhi/Mumbai-Johannesburg",
        "5 nights 5-star Johannesburg hotel",
        "Category 2 match ticket - Tournament Opener, The Wanderers Stadium",
        "Daily breakfast",
        "Soweto & Apartheid Museum guided tour",
        "Cradle of Humankind day trip",
        "Private airport transfers"
      ],
      "exclusions": [
        "Lunches and dinners except where noted",
        "Travel insurance",
        "South African visa/entry fees if applicable",
        "Tips and gratuities",
        "Optional excursions"
      ],
      "images": [
        {
          "url": "images/wanderers-stadium-johannesburg.jpg",
          "alt": "The Wanderers Stadium, Johannesburg, on match day"
        }
      ],
      "easygds": {
        "packageId": null,
        "placeId": null,
        "hotelId": null,
        "flightConfigId": null,
        "productCode": "pkg-cwc-opener-ind-aus-jnb"
      },
      "seasonality": {
        "peakMonths": [
          10,
          11
        ],
        "rainyMonths": [],
        "notes": "ICC Men's Cricket World Cup 2027 window (Oct-Nov); South African spring — book early, fixtures and venues indicative pending the official ICC schedule."
      },
      "compatibility": [
        "cwc2027",
        "cricket",
        "south-africa",
        "johannesburg"
      ],
      "sourceRefs": [
        "synthetic-baseline-v1"
      ],
      "confidence": "high",
      "availabilityMode": "indicative",
      "inclusionCompleteness": "complete",
      "exclusionCompleteness": "complete",
      "status": "active",
      "blockers": [],
      "route": [
        {
          "sequence": 1,
          "destinationId": "johannesburg",
          "nights": 5,
          "transportToNext": null
        }
      ],
      "relatedIds": [
        "xfer-jnb-airport",
        "exp-wanderers-stadium-tour"
      ],
      "relationships": [
        {
          "type": "optional-addon",
          "productId": "xfer-jnb-airport"
        },
        {
          "type": "optional-addon",
          "productId": "exp-wanderers-stadium-tour"
        },
        {
          "type": "alternative",
          "productId": "pkg-cwc-semifinal-jnb",
          "note": "Same venue, semi-final fixture"
        },
        {
          "type": "extension",
          "productId": "pkg-cwc-ind-pak-cpt",
          "note": "Combine with the Cape Town leg for a two-city World Cup trip"
        }
      ],
      "travellerFit": [
        "cricket-fans",
        "first-timers",
        "groups"
      ],
      "pace": "moderate",
      "minDurationDays": 6,
      "maxDurationDays": 10,
      "permittedExtraNights": 4,
      "combinableDestinations": [
        "johannesburg",
        "cape-town",
        "centurion"
      ],
      "accessibilityNotes": "Stadium has wheelchair-accessible seating on request at booking; guided tours use standard coaches.",
      "priceProvenance": {
        "sourceAmount": 2400,
        "sourceCurrency": "USD",
        "sourceBasis": "per-person",
        "fxRateToGbp": 0.79,
        "fxDate": "2026-08-20",
        "convertedAmount": 1896,
        "convertedCurrency": "GBP",
        "notes": "USD price as commercially quoted for this build (package); converted to GBP for catalog schema/runtime compliance."
      }
    },
    {
      "id": "pkg-cwc-ind-pak-cpt",
      "type": "package",
      "name": "CWC 2027: India v Pakistan, Cape Town",
      "summary": "The tournament's marquee group-stage blockbuster - India v Pakistan at Newlands - anchored by six days in Cape Town with Table Mountain and the Cape Peninsula.",
      "destinations": [
        "cape-town"
      ],
      "themes": [
        "cricket",
        "cwc2027",
        "marquee",
        "scenery"
      ],
      "duration": {
        "days": 6,
        "nights": 5
      },
      "tier": "signature",
      "basePrice": {
        "amount": 3002,
        "currency": "GBP",
        "basis": "per-person"
      },
      "inclusions": [
        "Air India flights Delhi/Mumbai-Johannesburg with onward connection to Cape Town",
        "5 nights 5-star Cape Town hotel",
        "Category 1 match ticket - India v Pakistan, Newlands Cricket Ground",
        "Daily breakfast",
        "Table Mountain cableway ticket",
        "Cape Peninsula & Boulders Beach guided tour",
        "Private airport transfers"
      ],
      "exclusions": [
        "Lunches and dinners except where noted",
        "Travel insurance",
        "South African visa/entry fees if applicable",
        "Tips and gratuities",
        "Optional excursions"
      ],
      "images": [
        {
          "url": "images/newlands-cricket-ground-cape-town.jpg",
          "alt": "Newlands Cricket Ground, Cape Town, on match day"
        }
      ],
      "easygds": {
        "packageId": null,
        "placeId": null,
        "hotelId": null,
        "flightConfigId": null,
        "productCode": "pkg-cwc-ind-pak-cpt"
      },
      "seasonality": {
        "peakMonths": [
          10,
          11
        ],
        "rainyMonths": [],
        "notes": "ICC Men's Cricket World Cup 2027 window (Oct-Nov); South African spring — book early, fixtures and venues indicative pending the official ICC schedule."
      },
      "compatibility": [
        "cwc2027",
        "cricket",
        "south-africa",
        "cape-town"
      ],
      "sourceRefs": [
        "synthetic-baseline-v1"
      ],
      "confidence": "high",
      "availabilityMode": "indicative",
      "inclusionCompleteness": "complete",
      "exclusionCompleteness": "complete",
      "status": "active",
      "blockers": [],
      "route": [
        {
          "sequence": 1,
          "destinationId": "cape-town",
          "nights": 5,
          "transportToNext": null
        }
      ],
      "relatedIds": [
        "exp-newlands-stadium-tour"
      ],
      "relationships": [
        {
          "type": "optional-addon",
          "productId": "exp-newlands-stadium-tour"
        },
        {
          "type": "alternative",
          "productId": "pkg-cwc-final-cpt",
          "note": "Same venue, final fixture"
        },
        {
          "type": "extension",
          "productId": "pkg-cwc-opener-ind-aus-jnb",
          "note": "Combine with the Johannesburg opener"
        }
      ],
      "travellerFit": [
        "cricket-fans",
        "rivalry-match",
        "groups"
      ],
      "pace": "moderate",
      "minDurationDays": 6,
      "maxDurationDays": 11,
      "permittedExtraNights": 5,
      "combinableDestinations": [
        "cape-town",
        "johannesburg"
      ],
      "accessibilityNotes": "Newlands has designated accessible viewing platforms bookable in advance; confirm mobility needs at booking.",
      "priceProvenance": {
        "sourceAmount": 3800,
        "sourceCurrency": "USD",
        "sourceBasis": "per-person",
        "fxRateToGbp": 0.79,
        "fxDate": "2026-08-20",
        "convertedAmount": 3002,
        "convertedCurrency": "GBP",
        "notes": "USD price as commercially quoted for this build (package); converted to GBP for catalog schema/runtime compliance."
      }
    },
    {
      "id": "pkg-cwc-ind-rsa-durban",
      "type": "package",
      "name": "CWC 2027: India v South Africa, Durban",
      "summary": "Five days on the Durban beachfront for a Group-stage India v South Africa fixture at Kingsmead, with uShaka Marine World and the city's historic Indian quarter.",
      "destinations": [
        "durban"
      ],
      "themes": [
        "cricket",
        "cwc2027",
        "beach",
        "city"
      ],
      "duration": {
        "days": 5,
        "nights": 4
      },
      "tier": "comfort",
      "basePrice": {
        "amount": 1738,
        "currency": "GBP",
        "basis": "per-person"
      },
      "inclusions": [
        "Air India flights Delhi/Mumbai-Johannesburg with onward connection to Durban",
        "4 nights 4-star Durban hotel",
        "Category 2 match ticket - India v South Africa, Kingsmead",
        "Daily breakfast",
        "uShaka Marine World & Golden Mile tour",
        "Durban Indian quarter & Victoria Street Market tour",
        "Private airport transfers"
      ],
      "exclusions": [
        "Lunches and dinners except where noted",
        "Travel insurance",
        "South African visa/entry fees if applicable",
        "Tips and gratuities",
        "Optional excursions"
      ],
      "images": [